{
  "candidate_archive_sha256": "aaaaaaaaaaaaaaaaaaaaaaaaaaaaaaaaaaaaaaaaaaaaaaaaaaaaaaaaaaaaaaaa",
  "challenge_sha256": "bbbbbbbbbbbbbbbbbbbbbbbbbbbbbbbbbbbbbbbbbbbbbbbbbbbbbbbbbbbbbbbb",
  "external_signer_id": "receipt-signer-v10-1-0001",
  "external_signer_identity_sha256": "57308531aa5ca8ba2468c8f3774de13b009ad4813be715325cc49300d0437494",
  "format_version": "1.0",
  "host_id": "host-v10-1-test-0001",
  "issued_at": "2026-08-07T00:52:28.611880+00:00",
  "manifest_id": "host-qualification-roots-v10-1-0001",
  "manifest_kind": "AZPR_V10_1_HOST_QUALIFICATION_ROOTS",
  "minimum_attestor_revocation_sequence": 7,
  "minimum_probe_revocation_sequence": 5,
  "minimum_trust_sequence": 9,
  "not_after": "2026-08-15T00:53:28.611880+00:00",
  "not_before": "2026-08-06T00:53:28.611880+00:00",
  "receipt_signing_key_id": "receipt-key-v10-1",
  "roots": {
    "external_signer_client": {
      "filename": "external-receipt-signer-client-v10.1",
      "sha256": "7fb7f94753b574e5cd246dfc39bdc3abca9767a6d963b05f638c6a4f53ffc4aa"
    },
    "external_signer_identity": {
      "filename": "external-receipt-signer-identity-v10.1.json",
      "sha256": "57308531aa5ca8ba2468c8f3774de13b009ad4813be715325cc49300d0437494"
    },
    "host_root_anchor_client": {
      "filename": "host-root-anchor-client-v10.1",
      "sha256": "4cef28e4c10d76fa6cd536eaacdab63d5ab047b46685fe7d3515b1668a115f2b"
    },
    "host_root_anchor_identity": {
      "filename": "host-root-anchor-identity-v10.1.json",
      "sha256": "1124cbc0d7af5d8c08e9b85cb6d404408535dc4aa279404d495b1aecc32a24fa"
    },
    "probe_attestor_keyring": {
      "filename": "probe-attestor-keyring-v10.1.json",
      "sha256": "175b219abc3490b4c71a80e8b76e494b7ec2c1eed0bd2d3645713477104c319b"
    },
    "probe_attestor_revocation_state": {
      "filename": "probe-attestor-revocation-state-v10.1.json",
      "sha256": "0046782358cfca99d6568f2e22978cb9c9397d9c9288c41890e77018c6150d6d"
    },
    "probe_keyring": {
      "filename": "probe-keyring-v10.1.json",
      "sha256": "4337c9c1ae29eb526d7da86780a3949551e5bf4b3bac5bca7b9abe71c3997cf0"
    },
    "probe_policy": {
      "filename": "probe-policy-v10.1.json",
      "sha256": "f1ff2eaad2db77e472e68bb52de8a69deb5c7fbea5ca91da1182c8b6fdbc8f34"
    },
    "probe_revocation_state": {
      "filename": "probe-revocation-state-v10.1.json",
      "sha256": "b4965b079b901242723b4740c810acebb19c2c4103d3e83d3937987c244681c9"
    },
    "probe_service_attestation": {
      "filename": "probe-service-attestation-v10.1.json",
      "sha256": "5a711abf8d54c682a0407f7861ecf7c6dd9430d6c89826a44fecf6ad76d3f2fe"
    },
    "probe_service_executable": {
      "filename": "probe-service-v10.1",
      "sha256": "306c6ca7407560340797866e077e053627ad409277d1b9da58106fce4cf717cb"
    },
    "probe_service_identity": {
      "filename": "probe-service-identity-v10.1.json",
      "sha256": "4b00f2125d58f084b2f99040caceb7560ab330b3f9f47a6e149195518c326a5f"
    },
    "qualification_receipt_signing_public_key": {
      "filename": "qualification-receipt-signing-v10.1.pem",
      "sha256": "8177e4eb3fd8468251a6c505d647df764cc40366f009b8408b66c2e5abca1913"
    },
    "qualification_trust_authority_public_key": {
      "filename": "qualification-trust-authority-v10.1.pem",
      "sha256": "58324aa7b51af4723f3911155eb3cdfbb696f0e5d9db6c9734bf8d4ff8db6d93"
    },
    "qualification_trust_manifest": {
      "filename": "qualification-trust-manifest-v10.1.json",
      "sha256": "936318a2b3c1b9bf9c2f687501373bcb602e4172733f20e1de40c1aeeaa249ee"
    }
  },
  "sequence": 11,
  "signature": "Wi6DtneAwfkgwnnyCqJFct04ag6eAca12Hyfc5h+iDcApIFXISKHDoBXmW4Mcf+YZ65oYDtt3buHHrjXzekaAw==",
  "signer_key_id": "host-qualification-authority-v10-1"
}
