{
  "candidate_archive_sha256": "aaaaaaaaaaaaaaaaaaaaaaaaaaaaaaaaaaaaaaaaaaaaaaaaaaaaaaaaaaaaaaaa",
  "challenge_sha256": "bbbbbbbbbbbbbbbbbbbbbbbbbbbbbbbbbbbbbbbbbbbbbbbbbbbbbbbbbbbbbbbb",
  "external_signer_id": "receipt-signer-v10-1-0001",
  "external_signer_identity_sha256": "d66f52b1b854b75319156dffd3c3156d34401f0cbb33b5f37a5bebc499300a89",
  "format_version": "1.0",
  "host_id": "host-v10-1-test-0001",
  "issued_at": "2026-08-07T00:52:28.434121+00:00",
  "manifest_id": "host-qualification-roots-v10-1-0001",
  "manifest_kind": "AZPR_V10_1_HOST_QUALIFICATION_ROOTS",
  "minimum_attestor_revocation_sequence": 7,
  "minimum_probe_revocation_sequence": 5,
  "minimum_trust_sequence": 9,
  "not_after": "2026-08-15T00:53:28.434121+00:00",
  "not_before": "2026-08-06T00:53:28.434121+00:00",
  "receipt_signing_key_id": "receipt-key-v10-1",
  "roots": {
    "external_signer_client": {
      "filename": "external-receipt-signer-client-v10.1",
      "sha256": "c8216a1cfd567309c3f012e5bfca563fbd57c0ab6a543cf907282ab0a7d45904"
    },
    "external_signer_identity": {
      "filename": "external-receipt-signer-identity-v10.1.json",
      "sha256": "d66f52b1b854b75319156dffd3c3156d34401f0cbb33b5f37a5bebc499300a89"
    },
    "host_root_anchor_client": {
      "filename": "host-root-anchor-client-v10.1",
      "sha256": "efc486dd5cb2a55733697008108e6091537873b2bdabc6d0d5677eeded935d0a"
    },
    "host_root_anchor_identity": {
      "filename": "host-root-anchor-identity-v10.1.json",
      "sha256": "bc0a1978ebb4f364a8bea2e4b1c6ecedd783fc7ef80b76e6ba4a5be621520776"
    },
    "probe_attestor_keyring": {
      "filename": "probe-attestor-keyring-v10.1.json",
      "sha256": "9020b8c24f44840d70cb80af8a301cc2b8af3aea3080f35a4f87b18c9c848b75"
    },
    "probe_attestor_revocation_state": {
      "filename": "probe-attestor-revocation-state-v10.1.json",
      "sha256": "70834d3e24c66bcc8b931cc2f799ad8adb5c80ff022b7e249f00ca9fa26cf060"
    },
    "probe_keyring": {
      "filename": "probe-keyring-v10.1.json",
      "sha256": "b9f4047eb25fd6826a0019f519aca2f7b63d1259e1085d04d85229a48de25891"
    },
    "probe_policy": {
      "filename": "probe-policy-v10.1.json",
      "sha256": "f1ff2eaad2db77e472e68bb52de8a69deb5c7fbea5ca91da1182c8b6fdbc8f34"
    },
    "probe_revocation_state": {
      "filename": "probe-revocation-state-v10.1.json",
      "sha256": "4d00de0b6bfe9a27874f90aa316f4e636dd3dd07745ae27931c483cc1de01672"
    },
    "probe_service_attestation": {
      "filename": "probe-service-attestation-v10.1.json",
      "sha256": "671d02edb1fd8c1e10ff1e4479c666cd95edd7dd11fe6ed831e130dcfc09a849"
    },
    "probe_service_executable": {
      "filename": "probe-service-v10.1",
      "sha256": "306c6ca7407560340797866e077e053627ad409277d1b9da58106fce4cf717cb"
    },
    "probe_service_identity": {
      "filename": "probe-service-identity-v10.1.json",
      "sha256": "4b00f2125d58f084b2f99040caceb7560ab330b3f9f47a6e149195518c326a5f"
    },
    "qualification_receipt_signing_public_key": {
      "filename": "qualification-receipt-signing-v10.1.pem",
      "sha256": "23ab0c2102e4217b0ba4e70c97552eebf9ae79ec3a2b7048932e53f1f9fe924e"
    },
    "qualification_trust_authority_public_key": {
      "filename": "qualification-trust-authority-v10.1.pem",
      "sha256": "abae63a6e30696bf8c32ab55f94fe8297a64ed42d2825643eadfe8a6388879a4"
    },
    "qualification_trust_manifest": {
      "filename": "qualification-trust-manifest-v10.1.json",
      "sha256": "d2e83ff9e77a71341ddd14c90e41485d1ee09e2baf4a7036b17b39d47db74105"
    }
  },
  "sequence": 11,
  "signature": "e4QbXM7LpZ+knpx6hQLM5hm0AA0IfpK6mCdJgdFMi1AQeFusARV1z4AVDqGDk1HNPWuM3233T7RiFdP2LCcVCw==",
  "signer_key_id": "host-qualification-authority-v10-1"
}
