{
  "candidate_archive_sha256": "aaaaaaaaaaaaaaaaaaaaaaaaaaaaaaaaaaaaaaaaaaaaaaaaaaaaaaaaaaaaaaaa",
  "challenge_sha256": "bbbbbbbbbbbbbbbbbbbbbbbbbbbbbbbbbbbbbbbbbbbbbbbbbbbbbbbbbbbbbbbb",
  "external_signer_id": "receipt-signer-v10-1-0001",
  "external_signer_identity_sha256": "374cf48e0fc429d8cbe5ddbb8bdf467eb88f307559ec6b3d5399faa5f7ea8ac7",
  "format_version": "1.0",
  "host_id": "host-v10-1-test-0001",
  "issued_at": "2026-08-07T00:52:29.412245+00:00",
  "manifest_id": "host-qualification-roots-v10-1-0001",
  "manifest_kind": "AZPR_V10_1_HOST_QUALIFICATION_ROOTS",
  "minimum_attestor_revocation_sequence": 7,
  "minimum_probe_revocation_sequence": 5,
  "minimum_trust_sequence": 9,
  "not_after": "2026-08-15T00:53:29.412245+00:00",
  "not_before": "2026-08-06T00:53:29.412245+00:00",
  "receipt_signing_key_id": "receipt-key-v10-1",
  "roots": {
    "external_signer_client": {
      "filename": "external-receipt-signer-client-v10.1",
      "sha256": "9c52d924bf8cdf9eb1eb2f8f83400c06cfbcdfbf42a39d464d952d1027dc850d"
    },
    "external_signer_identity": {
      "filename": "external-receipt-signer-identity-v10.1.json",
      "sha256": "374cf48e0fc429d8cbe5ddbb8bdf467eb88f307559ec6b3d5399faa5f7ea8ac7"
    },
    "host_root_anchor_client": {
      "filename": "host-root-anchor-client-v10.1",
      "sha256": "bf82ceff23f16f2b489ae5083ffb55350fdf390a8680f25d1bfe1ee129190acc"
    },
    "host_root_anchor_identity": {
      "filename": "host-root-anchor-identity-v10.1.json",
      "sha256": "d45b21bb82ab0052d4989ae69f7b9aab609eab88215c2bac905bb29a44ca4c42"
    },
    "probe_attestor_keyring": {
      "filename": "probe-attestor-keyring-v10.1.json",
      "sha256": "f785ff1196238a84a2faef817ddb6f289134d3aadb2dbc36c073ec74e1fe763f"
    },
    "probe_attestor_revocation_state": {
      "filename": "probe-attestor-revocation-state-v10.1.json",
      "sha256": "8df752221a4223b1a13fcf8712dd684e40f062e41096aa34bb505b0b8001a6db"
    },
    "probe_keyring": {
      "filename": "probe-keyring-v10.1.json",
      "sha256": "365a02e8eb43d33dc4455709482e187807519ec1d7318d0be9a402a7b19d9f74"
    },
    "probe_policy": {
      "filename": "probe-policy-v10.1.json",
      "sha256": "6237de74c498c2008e70f94719e7887c41f767e0ed51bcc1d7344e16ce4976dc"
    },
    "probe_revocation_state": {
      "filename": "probe-revocation-state-v10.1.json",
      "sha256": "a4544fcad269570553e8754d0f66bfb02f2511a936507ed23aafcd14b565d8c5"
    },
    "probe_service_attestation": {
      "filename": "probe-service-attestation-v10.1.json",
      "sha256": "4048784dd78e5efd9c5191ccb6ef627e6244847036780486f8b26f29fc4e307a"
    },
    "probe_service_executable": {
      "filename": "probe-service-v10.1",
      "sha256": "306c6ca7407560340797866e077e053627ad409277d1b9da58106fce4cf717cb"
    },
    "probe_service_identity": {
      "filename": "probe-service-identity-v10.1.json",
      "sha256": "4b00f2125d58f084b2f99040caceb7560ab330b3f9f47a6e149195518c326a5f"
    },
    "qualification_receipt_signing_public_key": {
      "filename": "qualification-receipt-signing-v10.1.pem",
      "sha256": "3ece891313992089fb4cc40ac3f23a3cec0edec97bd463bf72dcb68f0a8f893f"
    },
    "qualification_trust_authority_public_key": {
      "filename": "qualification-trust-authority-v10.1.pem",
      "sha256": "4e66b85b7f955884c684392491f08e12b851f66c365380645b5fc5b8817b870c"
    },
    "qualification_trust_manifest": {
      "filename": "qualification-trust-manifest-v10.1.json",
      "sha256": "04bedf154c6df0e4f0e071b7625510f192874fce7414101a45dac290b27f808e"
    }
  },
  "sequence": 11,
  "signature": "+EqDZqMiRSVL+agHDY9hbpsQkVRe+ZEu0T/4Rn6UqdnWVqdbCOM09FCfYz9EdZ2pw3fyBfFnULhsuuVJBstwAA==",
  "signer_key_id": "host-qualification-authority-v10-1"
}
