{
  "candidate_archive_sha256": "aaaaaaaaaaaaaaaaaaaaaaaaaaaaaaaaaaaaaaaaaaaaaaaaaaaaaaaaaaaaaaaa",
  "challenge_sha256": "bbbbbbbbbbbbbbbbbbbbbbbbbbbbbbbbbbbbbbbbbbbbbbbbbbbbbbbbbbbbbbbb",
  "external_signer_id": "receipt-signer-v10-1-0001",
  "external_signer_identity_sha256": "564ac03c0e7da47e4ba614d83e8dd4c0486463b3809497468892a22abc2c4b8c",
  "format_version": "1.0",
  "host_id": "host-v10-1-test-0001",
  "issued_at": "2026-08-07T00:31:30.917898+00:00",
  "manifest_id": "host-qualification-roots-v10-1-0001",
  "manifest_kind": "AZPR_V10_1_HOST_QUALIFICATION_ROOTS",
  "minimum_attestor_revocation_sequence": 7,
  "minimum_probe_revocation_sequence": 5,
  "minimum_trust_sequence": 9,
  "not_after": "2026-08-15T00:32:30.917898+00:00",
  "not_before": "2026-08-06T00:32:30.917898+00:00",
  "receipt_signing_key_id": "receipt-key-v10-1",
  "roots": {
    "external_signer_client": {
      "filename": "external-receipt-signer-client-v10.1",
      "sha256": "24b35f64dd56230c2cb614d3730cefbd1006fd0ce5e3e78fed58851dba9164b3"
    },
    "external_signer_identity": {
      "filename": "external-receipt-signer-identity-v10.1.json",
      "sha256": "564ac03c0e7da47e4ba614d83e8dd4c0486463b3809497468892a22abc2c4b8c"
    },
    "host_root_anchor_client": {
      "filename": "host-root-anchor-client-v10.1",
      "sha256": "4ba54385cdd6b6419970879f70be41edd8ebf032b9e81a678f96ee023070e5a2"
    },
    "host_root_anchor_identity": {
      "filename": "host-root-anchor-identity-v10.1.json",
      "sha256": "a0ac5bf16f942bccaa2e54b245ca38531a8c202bfa4a74f6fe3b344a724dd234"
    },
    "probe_attestor_keyring": {
      "filename": "probe-attestor-keyring-v10.1.json",
      "sha256": "6a031d1d7e64e2bfe7cd0715e632c8033f90623107fa4b4e0d42a980326f09fb"
    },
    "probe_attestor_revocation_state": {
      "filename": "probe-attestor-revocation-state-v10.1.json",
      "sha256": "36bbbcf2e7679d0f449df75519ce0be85f918662889e37b034b542e340509907"
    },
    "probe_keyring": {
      "filename": "probe-keyring-v10.1.json",
      "sha256": "f79ef3a7fa4e2ed2ecf007a415504a7474e27f184e9c5fc7b0c23fea486d6cad"
    },
    "probe_policy": {
      "filename": "probe-policy-v10.1.json",
      "sha256": "6237de74c498c2008e70f94719e7887c41f767e0ed51bcc1d7344e16ce4976dc"
    },
    "probe_revocation_state": {
      "filename": "probe-revocation-state-v10.1.json",
      "sha256": "44023e56165340ea55d137dce582ec763b7b01e4bc762d0e0d5c19c8f021c8c2"
    },
    "probe_service_attestation": {
      "filename": "probe-service-attestation-v10.1.json",
      "sha256": "f791efb57a7dfc46a99859f0e3cce3b79578cba88bc4fc6a5555673433a2ad86"
    },
    "probe_service_executable": {
      "filename": "probe-service-v10.1",
      "sha256": "306c6ca7407560340797866e077e053627ad409277d1b9da58106fce4cf717cb"
    },
    "probe_service_identity": {
      "filename": "probe-service-identity-v10.1.json",
      "sha256": "4b00f2125d58f084b2f99040caceb7560ab330b3f9f47a6e149195518c326a5f"
    },
    "qualification_receipt_signing_public_key": {
      "filename": "qualification-receipt-signing-v10.1.pem",
      "sha256": "f49208f3d47fd091f232cb401326ef367642f7fcdf0cd78064a7f22b37e8091d"
    },
    "qualification_trust_authority_public_key": {
      "filename": "qualification-trust-authority-v10.1.pem",
      "sha256": "965321f8a8c7c2f1e78d2739ecc0f36891381ab67ef4baddfa485e06023c3273"
    },
    "qualification_trust_manifest": {
      "filename": "qualification-trust-manifest-v10.1.json",
      "sha256": "b32ce5bcbaa8c24fdfcb64a17b0d7421674bd583c903d56f7fbdcfedeef70ec7"
    }
  },
  "sequence": 11,
  "signature": "lrGtH3/2VZIOfALPe5+ky1+c5v630GBzhmkUmu+oU7gqh3GTcgf0J1rE/en76PNFwak4cLr9C4NjNg1ZcseOCg==",
  "signer_key_id": "host-qualification-authority-v10-1"
}
