{
  "candidate_archive_sha256": "aaaaaaaaaaaaaaaaaaaaaaaaaaaaaaaaaaaaaaaaaaaaaaaaaaaaaaaaaaaaaaaa",
  "challenge_sha256": "bbbbbbbbbbbbbbbbbbbbbbbbbbbbbbbbbbbbbbbbbbbbbbbbbbbbbbbbbbbbbbbb",
  "external_signer_id": "receipt-signer-v10-1-0001",
  "external_signer_identity_sha256": "8e9010e48347a0c2248531da2fbabb8ce8abedfc4a5dcd217eb011670209ebdf",
  "format_version": "1.0",
  "host_id": "host-v10-1-test-0001",
  "issued_at": "2026-08-07T00:31:30.519608+00:00",
  "manifest_id": "host-qualification-roots-v10-1-0001",
  "manifest_kind": "AZPR_V10_1_HOST_QUALIFICATION_ROOTS",
  "minimum_attestor_revocation_sequence": 7,
  "minimum_probe_revocation_sequence": 5,
  "minimum_trust_sequence": 9,
  "not_after": "2026-08-15T00:32:30.519608+00:00",
  "not_before": "2026-08-06T00:32:30.519608+00:00",
  "receipt_signing_key_id": "receipt-key-v10-1",
  "roots": {
    "external_signer_client": {
      "filename": "external-receipt-signer-client-v10.1",
      "sha256": "fbb43979b7daad18d700461d0a22266e4e56cb696123ea7013b9e34aa985d000"
    },
    "external_signer_identity": {
      "filename": "external-receipt-signer-identity-v10.1.json",
      "sha256": "8e9010e48347a0c2248531da2fbabb8ce8abedfc4a5dcd217eb011670209ebdf"
    },
    "host_root_anchor_client": {
      "filename": "host-root-anchor-client-v10.1",
      "sha256": "e9528b6417a5f5919d4d34372c81d310bb151bf0844485bc93f49551a27d02e9"
    },
    "host_root_anchor_identity": {
      "filename": "host-root-anchor-identity-v10.1.json",
      "sha256": "b96b50993a791814008a926fa16ccde59dda2955d8c7f3925cdc504a9fd2a55d"
    },
    "probe_attestor_keyring": {
      "filename": "probe-attestor-keyring-v10.1.json",
      "sha256": "f41c341b58b603e4f1e7cd7b156c9332c16b3fd59b1da0297268aa4667b6e3c4"
    },
    "probe_attestor_revocation_state": {
      "filename": "probe-attestor-revocation-state-v10.1.json",
      "sha256": "a25f1b252dbdfe3c7d14ad09213aabc867845ced5e05a2a55f5feced53085553"
    },
    "probe_keyring": {
      "filename": "probe-keyring-v10.1.json",
      "sha256": "e9256a0e9acadf3ff62caaa881fa37dcacff5ce5dfeadbad03f6fa53c1865140"
    },
    "probe_policy": {
      "filename": "probe-policy-v10.1.json",
      "sha256": "f1ff2eaad2db77e472e68bb52de8a69deb5c7fbea5ca91da1182c8b6fdbc8f34"
    },
    "probe_revocation_state": {
      "filename": "probe-revocation-state-v10.1.json",
      "sha256": "d0c52105c18cb86c6dc64c3d95ace32406a39573ab08e42ab5155687ecbaa132"
    },
    "probe_service_attestation": {
      "filename": "probe-service-attestation-v10.1.json",
      "sha256": "d463ca7723f983ebe578bb8a76a11db5d491b74f15e08bbe4f07a49e9f6204a9"
    },
    "probe_service_executable": {
      "filename": "probe-service-v10.1",
      "sha256": "306c6ca7407560340797866e077e053627ad409277d1b9da58106fce4cf717cb"
    },
    "probe_service_identity": {
      "filename": "probe-service-identity-v10.1.json",
      "sha256": "4b00f2125d58f084b2f99040caceb7560ab330b3f9f47a6e149195518c326a5f"
    },
    "qualification_receipt_signing_public_key": {
      "filename": "qualification-receipt-signing-v10.1.pem",
      "sha256": "d4d4be27fd43e554d070dadc8f3264aff6533f268970c47f896fa1b2c1caefc8"
    },
    "qualification_trust_authority_public_key": {
      "filename": "qualification-trust-authority-v10.1.pem",
      "sha256": "fa14d087e16005ca777e839c95a88195b3ec080057324ffee0112ea22cf10156"
    },
    "qualification_trust_manifest": {
      "filename": "qualification-trust-manifest-v10.1.json",
      "sha256": "737f7d129b3eca6aa663e75c4f78b9917ddb418abfb58bc3ccc0df7e65d32ad0"
    }
  },
  "sequence": 11,
  "signature": "+6uq+4B7E0Kl4/+ShTBWkhfVv1GWbOiuyRcquYE84ht5I+OSBCxN+dvWUL5gaPrQe37xBKA1gsLG1AKI0C8RDg==",
  "signer_key_id": "host-qualification-authority-v10-1"
}
